{
  "project": "RheumaCheck",
  "package_version": "6.2",
  "language": "de-DE",
  "intended_system": "HomeDX",
  "modules": [
    {
      "module_id": "A",
      "title": "Patient:innen-Vorab-Anamnese und Stratifizierung",
      "target_group": "patient",
      "timing": "before_test_or_before_workflow",
      "purpose": "Symptomprofil, Vorab-Anamnese und strukturierte Stratifizierung vor Test-/Versorgungspfad.",
      "sections": [
        {
          "section_id": "A0",
          "title": "Einwilligung und Hinweis",
          "fields": [
            {
              "id": "A_consent_info_read",
              "type": "single_choice",
              "required": true,
              "label": "Ich habe den Hinweis gelesen, dass dieser Fragebogen keine ärztliche Diagnose ersetzt.",
              "options": [
                "ja",
                "nein"
              ]
            }
          ]
        },
        {
          "section_id": "A1",
          "title": "Beschwerden und Dauer",
          "fields": [
            {
              "id": "A_joint_pain",
              "type": "single_choice",
              "required": true,
              "label": "Haben Sie aktuell Gelenkschmerzen?",
              "options": [
                "ja",
                "nein"
              ]
            },
            {
              "id": "A_symptom_duration",
              "type": "single_choice",
              "required": false,
              "show_if": {
                "field": "A_joint_pain",
                "equals": "ja"
              },
              "label": "Seit wann bestehen die Beschwerden ungefähr?",
              "options": [
                "unter 2 Wochen",
                "2–6 Wochen",
                "6 Wochen bis 3 Monate",
                "mehr als 3 Monate",
                "mehr als 1 Jahr",
                "weiß nicht"
              ]
            },
            {
              "id": "A_morning_stiffness",
              "type": "single_choice",
              "required": false,
              "label": "Sind Ihre Gelenke morgens steif?",
              "options": [
                "ja",
                "nein",
                "unsicher"
              ]
            },
            {
              "id": "A_morning_stiffness_duration",
              "type": "single_choice",
              "required": false,
              "show_if": {
                "field": "A_morning_stiffness",
                "equals": "ja"
              },
              "label": "Wie lange hält die Morgensteifigkeit ungefähr an?",
              "options": [
                "unter 15 Minuten",
                "15–30 Minuten",
                "30–60 Minuten",
                "mehr als 60 Minuten",
                "weiß nicht"
              ]
            }
          ]
        },
        {
          "section_id": "A2",
          "title": "Betroffene Gelenke",
          "fields": [
            {
              "id": "A_affected_joints",
              "type": "multi_choice",
              "required": false,
              "label": "Welche Gelenke sind betroffen?",
              "options": [
                "Fingergrund-/mittelgelenke",
                "Handgelenke",
                "Zehen/Vorfuß",
                "Knie",
                "Schulter",
                "Ellenbogen",
                "Sprunggelenk",
                "andere",
                "weiß nicht"
              ]
            },
            {
              "id": "A_joint_swelling",
              "type": "single_choice",
              "required": false,
              "label": "Haben Sie Gelenkschwellungen bemerkt?",
              "options": [
                "ja",
                "nein",
                "unsicher"
              ]
            },
            {
              "id": "A_symmetrical",
              "type": "single_choice",
              "required": false,
              "label": "Treten die Beschwerden auf beiden Körperseiten ähnlich auf?",
              "options": [
                "ja",
                "nein",
                "teilweise",
                "unsicher"
              ]
            }
          ]
        },
        {
          "section_id": "A3",
          "title": "Belastung und Vorbefunde",
          "fields": [
            {
              "id": "A_pain_nrs",
              "type": "nrs_0_10",
              "required": false,
              "label": "Wie stark sind Ihre Schmerzen aktuell? 0 = keine Schmerzen, 10 = stärkste vorstellbare Schmerzen."
            },
            {
              "id": "A_function_limit",
              "type": "likert_5",
              "required": false,
              "label": "Wie stark beeinträchtigen die Beschwerden Ihren Alltag? 1 = gar nicht, 5 = sehr stark."
            },
            {
              "id": "A_known_lab_values",
              "type": "multi_choice",
              "required": false,
              "label": "Sind Ihnen bereits Laborwerte bekannt?",
              "options": [
                "Rheumafaktor/RF",
                "Anti-CCP/CCP",
                "CRP",
                "BSG",
                "keine bekannt",
                "weiß nicht"
              ]
            },
            {
              "id": "A_prior_physician_contact",
              "type": "multi_choice",
              "required": false,
              "label": "Bei welchen Stellen waren Sie wegen der Beschwerden bereits?",
              "options": [
                "Hausarztpraxis",
                "Orthopädie",
                "Rheumatologie",
                "Notaufnahme/Klinik",
                "noch nirgends",
                "andere"
              ]
            }
          ]
        }
      ]
    },
    {
      "module_id": "B",
      "title": "Rheumanetzwerk-/Ärzteumfrage zur Standardmethode und zum Versorgungspfad",
      "target_group": "physician_or_rheuma_network",
      "timing": "baseline_or_before_pilot",
      "purpose": "Erhebung der aktuellen Standardmethode, Wartezeiten, Verzögerungen und Versorgungspfade als Vergleichsbasis.",
      "sections": [
        {
          "section_id": "B1",
          "title": "Rolle und Setting",
          "fields": [
            {
              "id": "B_specialty",
              "type": "multi_choice",
              "required": true,
              "label": "In welchem Bereich sind Sie tätig?",
              "options": [
                "Hausarztpraxis",
                "Rheumatologie",
                "Innere Medizin",
                "Orthopädie",
                "Klinik/Ambulanz",
                "Labor/Diagnostik",
                "Versorgungskoordination",
                "anderes"
              ]
            },
            {
              "id": "B_setting",
              "type": "single_choice",
              "required": false,
              "label": "In welchem Setting arbeiten Sie überwiegend?",
              "options": [
                "Praxis/MVZ",
                "Krankenhaus",
                "Ambulanz",
                "Labor",
                "Netzwerk/Management",
                "anderes"
              ]
            }
          ]
        },
        {
          "section_id": "B2",
          "title": "Aktueller Versorgungspfad",
          "fields": [
            {
              "id": "B_current_first_contact",
              "type": "multi_choice",
              "required": false,
              "label": "Wo beginnt der Versorgungspfad bei Verdacht auf entzündlich-rheumatische Erkrankung typischerweise?",
              "options": [
                "Hausarztpraxis",
                "Orthopädie",
                "Rheumatologie",
                "Klinik/Notaufnahme",
                "Selbstsuche Patient:in",
                "unklar/wechselnd"
              ]
            },
            {
              "id": "B_standard_tests",
              "type": "multi_choice",
              "required": false,
              "label": "Welche Untersuchungen/Laborwerte werden typischerweise genutzt?",
              "options": [
                "Anamnese/körperliche Untersuchung",
                "CRP",
                "BSG",
                "Rheumafaktor/RF",
                "Anti-CCP/CCP",
                "Bildgebung",
                "Sonografie",
                "andere"
              ]
            },
            {
              "id": "B_wait_rheumatology_weeks",
              "type": "single_choice",
              "required": false,
              "label": "Wie lange warten Patient:innen typischerweise auf rheumatologische Abklärung?",
              "options": [
                "unter 2 Wochen",
                "2–6 Wochen",
                "6–12 Wochen",
                "mehr als 12 Wochen",
                "stark unterschiedlich",
                "keine Angabe möglich"
              ]
            },
            {
              "id": "B_main_bottlenecks",
              "type": "multi_choice",
              "required": false,
              "label": "Wo liegen aus Ihrer Sicht die wichtigsten Verzögerungen?",
              "options": [
                "Erkennen des Verdachts",
                "Labor/Befundverfügbarkeit",
                "Überweisung",
                "Terminverfügbarkeit Rheumatologie",
                "Patient:innenorganisation",
                "unklare Zuständigkeiten",
                "andere"
              ]
            }
          ]
        },
        {
          "section_id": "B3",
          "title": "Vergleichsbasis und Nutzenpotenzial",
          "fields": [
            {
              "id": "B_standard_method_documentable",
              "type": "likert_5",
              "required": false,
              "label": "Der heutige Standardpfad lässt sich in unserer Region gut dokumentieren. 1 = stimme gar nicht zu, 5 = stimme voll zu."
            },
            {
              "id": "B_rheumacheck_could_shortcut",
              "type": "likert_5",
              "required": false,
              "label": "Ein strukturierter POCT-/Fragebogenprozess könnte den Versorgungspfad sinnvoll verkürzen."